title,text,ImageURL1,ImageURL2
Музей-театр «Алёшино подворье»,"Музей-театр «Алешино подворье» , занимающий часть исторического центра Ярославля, представляет собой музей, прочно ассоциирующийся с русским фольклором, накопленными веками традициями и провинциальным колоритом. Гостей музея уже на пороге встречают знакомые со школьной скамьи герои. Персонажам русских былин и сказок здесь отведена главенствующая роль: озорному  Алеше Поповичу  не терпится развлечь пришедших прибаутками и занимательными рассказами, ему вторит смешной  домовой Шабарша , в процессе всеобщего веселья к ним подключается  красавица Любава , заботящаяся о гостях и приносящая им подарки. Музей-театр  находится на территории  туристического комплекса «Алеша Попович Двор» , тем не менее сюда могут зайти все желающие. Комплекс привлекает как горожан, так и приезжих сказочностью имеющихся интерьеров: своими резными балконами и крылечками, деревянной мебелью, массивными дверьми и номерами «с полатями». Здесь есть место и княжеским апартаментам, гости также могут попариться в  «Поповских банях»  или посетить  ресторан «Дядька Черномор»  с соответствующим оформлением в древнерусском стиле. В  «Алешином подворье»  на входе взрослые и дети получают бахилы в виде лаптей, туалеты же здесь обозначены не стандартными буквами «М» и «Ж», а вполне сказочными «Богатырская» и «Девичья»)) Место однозначно является одним из наиболее известных фольклорных комплексов города, способным удивить всех от мала до велика. Случается, что за день побывать в музее-театре успевают до 150 человек. Каждый посетитель музея-театра становится частью масштабного представления. Гости загадывают желания в процессе перформанса, «заряжаются» здоровьем, погружая ладони в живую воду, узнают малоизвестные приметы и предания, к примеру, если погладить коня  Гая Юлия Цезаря , то в скором времени можно обзавестись собственной лошадью, если же поведение в последние дни оставляло желать лучшего, то омывать руки «живой» водой не стоит — они могут отвалиться. Погружение в богатырский быт XII века, интерактивная экскурсия никого не оставит равнодушным, помимо этого музей предлагает сказочный квест для всех возрастов для самых активных и сообразительных поклонников приключений.  Для взрослых предлагается праздничная программа «Угощение от Любавы», радующая гостей наливочкой, квашеной капустой и хрустящими огурчиками. А дети в это время могут посетить ряд образовательных краеведческих проектов или творческие уроки истории, где в игровой форме узнают от сказочных героев, как жили и вели быт люди в средневековой Руси.  Музей предлагает к изучению старинные русские ремесла, такие как плетение на коклюшках и гончарное дело, также здесь можно изучить современные техники — эбру, мыловарение и фьюзинг. 🧭  Где:  г.   Ярославль, ул. Первомайская, 55 ⌛ Когда:  ежедневно с 10:00 до 18:00, пн – выходной ☎  Контакты:  +7(910)973-31-32; +7(4852)64-04-31 💰 Стоимость:  театрализованная экскурсия: взрослые – 250 руб., дети – 180 руб. 💻 Сайт:  http://ap-dvor.ru/muzej / Как добраться: Музей находится недалеко от стен  Спасо-Преображенского монастыря , это исторический центр города. Доехать до места можно на любом виде общественного транспорта, следующем через площадь Богоявления. Если сойти на остановке «Первомайская», необходимо будет перейти от главпочтамта на противоположную сторону Богоявленской площади и какое-то время идти пешим шагом до Которосльной набережной. Сюда идут маршруты автобусов  № 2 ,  № 5 ,  № 8 ,  № 14 ,  № 19к ,  № 21Б ,  № 33 ,  № 42 ,  № 76 ,  № 139а , троллейбус  № 9 , маршрутное такси  № 36 ,  № 37 ,  № 45 ,  № 46 ,  № 47 ,  № 61 ,  № 71 ,  № 73 ,  № 80 ,  № 81 ,  № 82 ,  № 84 ,  № 87 ,  № 91 ,  № 94 ,  № 96 ,  № 97 ,  № 98 ,  № 176 ,  № 178 .",https://sun9-49.userapi.com/hwuPTOS3Og5CW48q5pN1Ia-TVGus0qO7TYD2vQ/QFTDV6rszaU.jpg,https://sun9-39.userapi.com/P9Ysg09C56ioJ6v5CxTZq5yoA37XLmtB2I1MBQ/BOo1DlZuTzU.jpg
Резиденция Государыни главной масленицы страны,"Резиденция государыни Главной Масленицы страны  - единственный  интерактивный музей  🏣 подобной тематики в России. Город Ярославль является местом проведения одного из известнейших российских праздников -  Масленицы . Ежегодно в Ярославле проходит главное событие праздничной 🎉 недели - Главная Масленица страны. Праздник Масленицы это целая неделя фольклорных событий: народных гуляний, песен, танцев, игр и традиционной Русской кухни 🥞. Резиденция  – часть уникального  рубленого города   🌆, воссозданного по чертежам и сохранившимся киноматериалам 1913 года, который был построен в честь последнего визита императорской 🤴 семьи и царя Николая II в Ярославль. Во дворе музея, организованы развлекательные площадки 👨‍👩‍👧‍👦 для участия в старинных русских забавах и играх. А в самом музее Вы получите уникальную возможность увидеть своими глазами Рабочий кабинет Государыни, ее Гардеробную с хранящейся там одеждой 👘, Кладовую с подарками и запасами со всех концов земли и, конечно же, Тронный зал. Лучшие повара ее Величества угостят Вас традиционными русскими кушаньями 🥞 из дровяной печи, а придворные артисты не дадут заскучать, разыграв 🎹сцены и обряды празднования Масленицы. Для самых маленьких гостей музей подготовил игровую развлекательную программу: 🔹 русские народные игры «Золотые ворота»; 🔹 игра «Ручеек»; 🔹 увлекательная экскурсия по музею. Резиденция  расположена на территории  гостинично-ресторанного комплекса «Иоанн Васильевич»  🍸 🧭  Где:  г.   Ярославль, Революционный проезд, 14а ⌛ Когда:  Пн-Пт с 10.00 до 16.00 ☎  Контакты:  +7 (901) 994-05-14 💰 Стоимость:  взрослый – 300 руб., дети (до 14 лет) – 150 руб., дети до 5 лет – бесплатно.  💻 Сайт:  https://maslenica.info /",https://sun9-37.userapi.com/r9lhKRV-LIdIf5IDqtDi9ED_ei_7l591KZjySw/ZofQ9oRS0JM.jpg,https://sun9-48.userapi.com/OzqU6gxWr4ei84gwWPJO2dlHVSE0OmWoUkzBKw/dljXgAA8CUs.jpg
"Историко-культурный комплекс ""Вятское»","Историко-культурный комплекс «Вятское» имени Е. А. Анкудиновой  — музейный комплекс, расположенный на территории 🏘  ярославского села Вятское . Объект всемирного наследия ЮНЕСКО в России. Проект был начат в 2008 году и продолжает развитие на средства 💳, инвестируемые предпринимателем  О. А. Жаровым Музейный комплекс включает в себя 12 открытых в Вятском музеев 🏣 , 1 филиал «Вятского» в Ярославле —  Музей современного искусства «Дом муз»  и более 30 памятников 🗿 архитектуры. В  музейный комплекс историко-культурного комплекса «Вятское»  🏘 входят постоянно действующие экспозиции: 🔸  Музей русской предприимчивост и 🔸  Музей возвращённой святыни   🔸  Музей «Дом Горохова»   🔸  Музей «Русская банька по-чёрному»   🔸  Музей кухонной машинерии   🔸  Музей «Детский мир » 🔸  Музей-Печатня «Страницы истории печатного дела » 🔸  Политехнический музей   🔸  Музей «Дом ангелов»   🔸  Музей «Нумера купцов братьев Урловых»   🔸  Музей «Звуки времени»   🔸  Музей русских забав   В «Вятском» ведётся краеведческая и издательская 🗞 работа. На базе «Вятского» проходят конференции и семинары, посвященные развитию туризма, музейного дела, вопросам современного искусства.  Ежегодно проводятся фестивали 🎤 «Провинция – душа России», «Дни Н. А. Некрасова в Вятском», организуются массовые гуляния на Новый год, Масленицу и другие праздники.  Возрождаются традиции местных народных промыслов и известного досоветского местного бренда – ""вятских"" 🥒 огурцов. Туристический поток 🏘музейного комплекса составляет более 100 тыс. посетителей в год. 🧭  Где:  Ярославская область, Некрасовский район, с. Вятское, ул. Советская, д. 9 ⌛ Когда:  ежедневно с 10.30 до 18.00, без обеда. ☎  Контакты:  8 800 302-70-05; +7 929 077-83-60; +7 929 077-83-61; +7 961 160-81-17; +7 929 077-83-54 💰 Стоимость:  уточнить по 📞 💻  Сайт:  http://вятское-село.рф /",https://sun9-19.userapi.com/vuqMyRUdp9qfUga54npdKnQr0lDJZeHg5DYoQA/ixPWd3UjKQA.jpg,https://sun9-35.userapi.com/Xg2GkDF7Rcmf-liCBYKZh4FBZUtQjsS_WI6Khg/a5Cg0c-gYVQ.jpg
Ярославский государственный театр юного зрителя им. В.С.Розова,"Ярославский ТЮЗ  🎭 был основан в 1984 году при деятельной поддержке Виктора Сергеевича Розова и открылся премьерой спектакля по его пьесе «Вечно живые». Это было долгожданное событие в Ярославле 🌆, городе первого русского профессионального театра. За прошедшие четверть века на сцене Ярославского ТЮЗа 🎭 состоялось 139 премьер. Репертуар театра — спектакли для детей, подростков и старшего поколения 👨‍👩‍👧‍👦 . Труппа Ярославского ТЮЗа 🎭 по праву считается одной из самых музыкальных среди молодежных театров России. Звук живого оркестра, сложное многоголосное пение, яркие сольные номера стали украшением многих спектаклей театра. Труппа театра гармонично сбалансирована и соединяет старшее, среднее и молодое поколение актеров. Среди них 6 заслуженных 🏆 артистов России и народный артист РФ Виталий Стужев. В настоящее время театр пополнился молодыми актерами-выпускниками, которые играют ведущие роли во многих спектаклях. Ярославский театр юного зрителя участник многочисленных российских и международных театральных фестивалей. Спектакли и актеры театра были отмечены наградами 🏆 на фестивалях в Германии, Польше, Югославии, Москве, Санкт-Петербурге и др. Театр шесть раз становился обладателем областной театральной премии имени Ф. Г. Волкова. Всероссийский театральный фестиваль Rozovfest - визитная карточка театра 🎫. Театр также ведет широкую гуманитарную и просветительскую работу в городе и области. Он участвует в программе поддержки детей с ограниченными возможностями, показывает 🎭 спектакли в детских домах, содействует реабилитации подростков, находящихся в местах лишения свободы. В ТЮЗе 🎭 имеется две сцены, на которых идут постановки, как детских спектаклей, так и пьес для более взрослого зрителя, поражающих своей живостью и проникновенным психологическим сюжетом. Спектакли играют на обеих сценах. 🏛 Театральный зал содержит 750 мест, а малый зал – 100 мест. 🧭  Где:  г.   Ярославль, ул. Свободы, д. 23 ⌛ Когда:  работа кассы — ежедневно, 10:00–19:00, перерыв 14:00–14:30 ☎  Контакты:  +7 (4852) 30-86-83 💻 Сайт:  http://www.yartuz.ru /",https://sun9-63.userapi.com/y-VY_331lF1ok8O-RzoPPRQ3YqgJYxbdYoSnlQ/mWElz8IcJBE.jpg,https://sun9-62.userapi.com/I_borRCL3K5mTo4xTsABsh6qQ4OJhvWt3Tt8cg/Tt9Oh7ybQOU.jpg
Музей истории Ярославского шинного завода,"Музеи при предприятиях — отличная возможность окунуться в прошлое. И  Музей истории Ярославского шинного завода  🏣 тому полное подтверждение. Открытие музея состоялось 30 октября 2002 года в честь с 70-летия  Ярославского шинного завода .  Ярославский шинный завод  — одно из старейших ярославских предприятий ⚫, свою деятельность он начал в далеком 1932 году. Место для первого в СССР завода по производству шин выбирали долго, в результате остановившись на  Полушкиной роще  🌳 — излюбленном месте отдыха горожан. Завод строили преимущественно сельские жители, а из транспорта имелись всего лишь 4 грузовые машины, тяжелую технику заменяли лошади 🐴. Музей ЯШЗ камерный, компактный, в нём два зала и небольшой холл. Основной зал знакомит нас с многолетней историей Ярославского шинного завода, а малый зал полностью посвящен современности и АО «Кордиант». Здесь действуют постоянные экспозиции, с которыми всегда может ознакомиться любой посетитель 👨‍👩‍👧‍👦 , а так же различные интерактивные временные выставки. Удивительный музей рассказывает не только о шинном производстве. В экспозиции представлена вся нелегкая жизнь времен Советского союза 🚩 . Здесь на черно-белых советских и на ярких современных фотографиях показаны производственные победы и трудности прошлого и достижения настоящего. Музей стал гордостью заводчан и неотъемлемой частью общественной 🎤 жизни завода и города. Он воспринимается шинниками как своеобразный культурный центр заводской жизни, как пространство, открытое для творческой реализации. За последние несколько лет музей полюбили активисты Молодёжного совета завода: здесь проводятся традиционные детские праздники, такие как Новый год 🎄 и Праздник первоклассника.. 🧭  Где:  г.   Ярославль, ул. Советская, 81 ⌛ Когда:  Пн-Пт 8:00–17:00, перерыв 12:00–13:00 ☎  Контакты:  8 (485) 279-16-09 Фейсбук:   https://www.facebook.com/yashzmuseum/  ",https://sun9-33.userapi.com/jmp7Pk6FU3x7upGMAEXdYAU16Jf3dSa4S9cuyA/ZbfeNvzPyL0.jpg,https://sun9-15.userapi.com/kMqCnWAuJdhheGRS0T-6h6QRDSax5WuwixuADg/VL20af0zhyw.jpg
МУЗЕЙ РУССКОГО НАЦИОНАЛЬНОГО ПИСЬМА в Ярославле,"В 2020 году в Ярославле 🌆 состоялось открытие первого в России  «МУЗЕЯ РУССКОГО НАЦИОНАЛЬНОГО ПИСЬМА» ✒ Музей 🏣 создавался силами преподавателей, родителей и учащихся авторской школы Юрия Ивановича Аруцева «Русская Каллиграфия и Вязь» 📝   Первыми экспонатами музея стали пишущие принадлежности прошедших столетий, остроконечные перья ✒ и держатели к ним производства ярославского завода «Оргтехника», чернильницы, ученические тетради XX столетия, редкие книги и уникальные каллиграфические 📜 работы мастеров школы. В настоящее время в музее учтено более 500 экспонатов. Коллекция музея сформирована по нескольким 📜 📜 📜 экспозициям: 🔹 «Парадное письмо» ✉. Представлено более 200 каллиграфических работ учащихся школы и мастеров каллиграфии. 🔹 «Искусство монограммы». Представлено около 50 работ мастеров школы. 🔹 «Каллиграфия по фотографии» 🖼. Новое направление в искусстве ручного письма. Представлено пять уникальных работ основателя школы. 🔹 «Ярославская вязь». Новое направление в искусстве русской вязи, получившее развитие с конца 90-х годов. Представлено 25 📜 уникальных работ мастеров школы. 🔹 «Моя золотая подпись». Новое направление в искусстве разработки личной подписи ⚜ . Представлено около ста уникальных разработок подписи граждан России и зарубежья. 🔹 «Библиотека каллиграфа». Собрание книг 📚 , в том числе редких, по искусству письма , его истории и эволюции, авторских методик преподавания чистописания и каллиграфии выпускников школы. В музее будут проводиться региональные и международные выставки каллиграфии 🖊 , конференции, учебные семинары и лекционные 📝 курсы по истории русской письменности, педагогике, филологии, физиологии письма и сохранении здоровья детей и юношества. В настоящее время уже проводятся мастер-классы по каллиграфии ✒ . 🧭  Где:  г.   Ярославль, ул. Трефолева, д.11 ⌛ Когда:  пн,вт,ср,чт,сб,вс 12:00–19:00 (экскурсии по предварительной заявке) 💰 Стоимость:  Экскурсии: группы до 15 чел. — 2000 руб., до 30 чел. — 3000 руб. Мастер-класс: группы до 15 чел. — 3000 руб. Экскурсия с проведением мастер-класса для семьи — 250 руб./чел. Инвалиды и дети дошкольного возраста — бесплатно. ☎  Контакты:  +7 903 828-88-23 Спасибо большое за используемый материал  https://privatemuseums.ru",https://sun9-53.userapi.com/QIJ1W1FGCtA4XjixIve_6cwUVPfW7HBk_j6wqg/FfnB7tnt-OA.jpg,https://sun9-18.userapi.com/_6jJQlHX4udio0OT4LzA2dKAu7ZnPTJlEztQkw/_sA2JRSMk30.jpg
