title,text,ImageURL1,ImageURL2
Музейный комплекс «Толбухино»,"Автобусные 🚌 многодневные и однодневные экскурсии в музеи Ярославля предлагает  музейное объединение ""Толбухино"" . Вас ждет незабываемое приключение в удивительным мир старины от бронзового века до наших дней. За 5 лет в селе Толбухино 🏘 создан  музейный комплекс , который вошел в  ТОП-10  крупнейших музейных объединений России. Историко-музейный комплекс  «Толбухино»  объединяет музей маршала  Ф. И. Толбухина , московские, петербургские, владимирские и ярославские 🏣 музеи, переехавшие в село Толбухино (24 музея), и архитектурные памятники: «Чайный дом» Фёдора Кислова, дворец- усадьба  Ивана Кислова, усадьба Фёдора Шелепова. Также представлена комплексная экспозиция  фатьяновской культуры : «Святилище Фатьяновских племён», музей  Бронзового века ,  мегалитическая  обсерватория «Столбы» 🗿 и  Синь-камень . В ходе экскурсий по  музеям 🏣  , а это:  «Музей бронзового века», Музей Петра I, Музей старинных гравюр, Музей связи, Музей фарфора, Музей хрусталя, Музей музыки 🎻, Музей моды и другие. , старинным улицам села Толбухино, посетители узнают уникальную историческую информацию о знаменитой фатьяновской культуре, увидят и потрогают руками 🏺 подлинные предметы III тысячелетия до н.э., услышат истории о крестьянском и купеческом сословии, отхожих промыслах кузнечном и лепном промысле, швейном деле и других ремеслах жителей села Давыдково (ныне село Толбухино) . Узнают удивительные легенды о посещении этих мест царем Иваном Грозным и царем Петром Великим. Само село Толбухино находится в заповедных лесах 🌳🌳 вокруг живописного озера Тарасово. До сих пор местные жители находят в ручьях, оврагах, курганах древние монеты, россыпи керамики, наконечники стрел 🏹, копий периода бронзового века. Программа экскурсии: 🔸 Фальяновская цивилизация. Уникальные артефакты и находки; 🔸 посещение 25 уникальных музеев; 🔸 экотуризм — все от рыбалки на озере до чаепития; 🔸 интерактивные программы; 🔸 чаепитие. 🧭  Где:  Ярославская обл., Ярославский район, с. Толбухино, ул. Советская, д. 1; ⌛ Когда:  ежедневно (уточнить по 📞); ☎  Контакты:  8-961-157-89-09, (4852) 79-57-92, 8-910-972-77-68 💰 Стоимость:  1000 рублей (Посещение 19 музеев из 25, бобровой плотины, русское чаепитие с дегустацией ""Иван-чая». Пенсионерам и детям скидка); 💻 Сайт:   https://muzei76.ru / 🚌 Как добраться:  18 км по трассе М-8. Проезд автобусом № 125 КДП «Заволжье» (у «Космоса») до Толбухино.",https://sun9-54.userapi.com/PiR7S02yOApl6o7TbYXW3FyJ1PIuNcrus4gpuA/rxbuM28Qhuc.jpg,https://sun9-61.userapi.com/3Rxpy72seE2PspE2ht17ezxTftgPR_tigz7Lmg/73egyIW1Jcg.jpg
Демидовский сад,"Демидовский сад  — сквер в центре города Ярославля 🌆, расположен на  площади Челюскинцев  (бывшей Плацпарадной), между  Советской площадью  и  Почтовой улицей . Назван по находящемуся в его центре  Демидовскому столпу  🗼. Входит в перечень особо охраняемых природных территорий Ярославской области. Плацпарадная площадь появилась в 1778 году вследствие перестройки центра Ярославля по регулярному плану. Она была предназначена для проведения военных смотров и парадов. В 1829 году в центре площади была установлена памятная колонна 🗼 честь  Павла Григорьевича Демидова , основателя  первого высшего учебного заведения в Ярославле  —  Ярославское Демидовское училище высших наук, Демидовский юридический лицей, Демидовский лицей  (современный  Ярославский государственный университет имени П. Г. Демидова  считается его преемником). В 1885  городской голова   Иван Александрович Вахрамеев  на собственные средства разбил на площади сад 🌳. Поначалу сад назывался  Вахрамеевским , однако официальное название вскоре вытеснилось «народным»  Демидовский , по стоявшему в центре парка столпу.  В саду был обустроен фонтан ⛲, украшенный фигурой аиста (в советские годы птицу сменил Буратино, а затем – сфера с чашами). В 1918 году, после установления советской власти, Плацпарадная площадь была переименована в  площадь Мира , а главная аллея сада переименована в бульвар Мира. В саду был сооружён  памятник большевикам , застреленным во время восстания. В 1919 году рядом с памятником производились захоронения красноармейцев, погибших при подавлении бунта местных крестьян. В 1931 году  Демидовский столп  был разрушен, а сам сад переименован в «сквер Братских могил». Но в 2005 году был успешно воссоздан и получил своё первоначальное название, кстати, новый памятник имеет 100% копию старого и является самым высоким монументом города Ярославля. А саду было возвращено историческое название. Демидовский сад готов принять своих гостей в абсолютно любое время, независимо от погоды и времени года, и кстати, совершенно бесплатно. 🧭  Где:  г. Ярославль, бульвар Мира ⌛ Когда:  ежедневно 💰 Стоимость:  бесплатно⠀",https://sun9-75.userapi.com/n5FxUp0Zrp33ngo0wa6GZ4z8H9yvGNwvdTUasg/lVAyRsIxHyg.jpg,https://sun9-59.userapi.com/-s9GmJZjMH1r_ysZbszVEnDVTF1G6gflj_82MQ/n92E1AidmYA.jpg
МУЗЕЙ ПОЖАРНОГО ДЕЛА,"На Московском проспекте в Ярославле находится здание уникального  Музея пожарного дела 🔥 , который принадлежит Главному управлению МЧС России по Ярославской области. Появление этого музея связано с тем, что в древности город Ярославль 🌆 был практически весь сделан из дерева. Деревянные дома, мостки, перекинутые через канавы и ручьи, настилы во дворах и на улицах – всё было деревянным. Поэтому и пожары в городе были частыми гостями. В 1658 году случился Великий пожар  🔥 . Диораму музея 🏣 демонстрируют посетителям так, чтобы наиболее остро почувствовался весь трагизм момента Великого пожара. При погашенном свете из-за открывающихся занавесей появляется древний деревянный город, который охвачен пламенем от Медвежьего ручья до площади Богоявления, существующей поныне. Свидетели страшной картины разрушения слышат звон колоколов, треск дерева. Пожар перерастает в огненную бурю, которая течёт по строениям, охватывая всё на своём пути, не щадя ни изб, ни храмов. Катастрофа развилась до таких масштабов, что огонь  🔥  перебрался через Которосль, захватив Тропинскую слободу. Обугленные башни и каменные церкви – всё, что осталось от города. 29 храмов, 3 монастыря, древняя городская стена, торговые ряды, около полутора тысяч домов, древние книги и рукописи. Огонь поглотил всё. В музее наглядно показывается, как развивалась пожарная служба 🚒 на протяжении двух веков. Здесь представлены первые насосы, которые можно потрогать руками и разнообразное оборудование, в том числе и современное. Небольшие экспозиции посвящены выдающимся людям, трудившимся в данной отрасли в Ярославле 🌆. Также музей выполняет воспитательную функцию, демонстрируя то, как просто жилая квартира может быть охвачена пожаром и что от неё потом останется. В музее представлены три просторных зала: 🔹 Героический зал: рядом с героями истории Ярославля В.Гиляровским и В.Мариным нашли своё место герои современности. В. Тарасов, А. Шатохин, Е. Яковлев – они пожертвовали своими жизнями во имя спасения людей при тушении пожаров в Ярославской области. Здесь собраны материалы и фотографии, повествующие о подвигах этих людей. Молодые пожарные именно в этом зале приносят присягу верности профессии, которую избрали; 🔹 Современный зал: представлено современное пожарное и спасательное оборудование. Экспозиция знакомит посетителей с новейшими инженерно-техническими решениями, которые обеспечивают пожарную безопасность. Их работа продемонстрирована на механических экспонатах «Театр юного зрителя» и «Дом повышенной этажности»; 🔹 Исторический зал: представлена диорама — Великий пожар. 🧭  Где:  г.   Ярославль, ул. Силикатная, д.18 ⌛ Когда:  Пн-Пт (по предварительной записи) ☎  Контакты:  (4852) 44-78-24",https://sun9-42.userapi.com/z2tcAwd95vcIeL6Z6Srn530e96WAxh-9Xx7Idg/vabuhxyPJpo.jpg,https://sun9-65.userapi.com/lPKntGJRPriH5Fvke8PcfwRaMPRYOj5jP0Ib5w/8MZ-xCbYino.jpg
Музей стрелкового и холодного оружия,"В Ярославле 🌆 в 2020 году открылся частный  Музей стрелкового и холодного оружия . Руководителем музея стал Иосиф Ботерашвили, который два десятка лет собирал и хранил будущие экспонаты ⚔. Музей имеет четыре зала общей площадью 150 квадратных метров, в которых представлены выставки стрелкового и холодного 🗡 оружия.  В экспозиции собраны все модели автомата Калашникова, уникальные образцы винтовок и револьверов. 🔫 Коллекция собиралась много лет и содержит «стволы» различных эпох, стран и народов. Всего в экспозиции представлено более 500 предметов. Дополняет экспозицию коллекция холодного 🗡 клинкового оружия. Его представляет друг директора музея Михаил Кузнецов. 🧭  Где:  г.   Ярославль, ул. Свободы, 56/35 ⌛ Когда:  ежедневно с 10:00 до 19:00 ☎  Контакты:  +7 4852 47-74-47",https://sun9-40.userapi.com/KJ0l5HFQLUfoCWPkjYFis6mvF44Qv07czvC0nw/jO1wbfb9L3g.jpg,https://sun9-31.userapi.com/KSBKlDWvhlMyfV2AmTbXKuvU2ufEKEjdZeaczw/5w_3gNGFDz4.jpg
Музей Максима Богдановича,"Мемориальный дом-музей М. Богдановича , полное официальное название —  Центр белорусской культуры. Музей Максима Богдановича  —  литературный   музей  в  Ярославле  🌆, созданный в мемориальном доме классика  белорусской литературы   М. А. Богдановича , где с 1912 по 1914 годы жила семья Богдановичей. На сегодняшний день это единственный в пределах города музей литературного ✒ профиля. Открытие музея состоялось в декабре 1992 года. Первоначальной задачей музея стало знакомство жителей города с творческим 📚 наследием белорусского поэта, восемь из неполных двадцати шести лет прожившего в Ярославле. Ярославль стал для поэта второй Родиной, в нашем городе был написан единственный прижизненный сборник 📖 стихов М.Богдановича. Одна из центральных улиц города названа именем поэта, у здания бывшей мужской гимназии установлен памятник М.Богдановичу. В настоящее время на базе музея собрана одна из наиболее полных в Российских регионах библиотек 📚публикаций поэта и библиографической литературы о нем, а также библиотека белорусской литературы . Сотрудниками музея разработан большой методический материал по популяризации творчества М.Богдановича среди россиян, не владеющих белорусским языком. В настоящее время музей выступает как транслятор этничности, решая определенные задачи по сохранению национального языка, традиций, воспитания патриотизма, толерантности. В 1995 г. Музей получил статус Центра Белорусской культуры.  В Центре совместно с белорусской диаспорой Ярославля проводятся народные 👨‍👩‍👧‍👦 национальные праздники: ''Каляды'', Дзяды, Гуканне вясны и др. Регулярно организуются Дни белорусской кухни. Собрана коллекция предметов народного быта белорусских переселенцев. Здесь можно услышать белорусские песни, почитать книги белорусских авторов, ознакомиться с изданиями белорусской прессы. В Центре проводятся Дни национальной белорусской кухни 🥞, музыкальные и поэтические вечера, праздники, посвящённые знаменательным датам в истории Белоруссии. В программе Центра предлагается множество интерактивных программ для ярославцев и для гостей нашего города: 🔹 традиции русского чаепития; 🔹 посиделки у русской печки; 🔹 дегустация белорусских национальных блюд; 🔹 проведение Дня именинника в залах музея; 🔹 программа по созданию на территории усадьбы проекта русско-белорусская горница. 🧭  Где:  г.   Ярославль, ул. Чайковского, 21, Кировский р-н. ⌛ Когда:  пн-сб 9:00–18:00 (воскресенье — выходной) ☎  Контакты:  +7 4852 32-93-54 💻 Сайт:  http://mukmig.yaroslavl.ru/?menu0402 =",https://sun9-6.userapi.com/-jBPDrrKRTsqvbetUdzq6pBGcaYMIF46cpOXTg/ED1KtWN7__k.jpg,https://sun9-51.userapi.com/jz5LjaMF0VwU14zDbOzfMSDbF3o9gdJ_dr6aOg/wt6DifjWDh0.jpg
